,Unnamed: 0,date,comments,sentiment
0,0,22-05-02,They will write stories about us one day,positive
1,1,22-05-02,Someone just help me a get a clear view of how long you guys have been keeping a hold onto your coins!,positive
2,2,22-05-02,"Can't be touched, can't be stopped
Can't be moved, can't be rocked
Can't be shook, we hot

Y’all must’ve forgot",neutral
3,3,22-05-02,"I always think it's hilarious on days like today, when traditional markets (and even gold) are down, all the people crowing about ""correlation"" disappear. They will forget this day the next time it suits them. Very interesting.",neutral
4,4,22-05-02,"Dont forget to move your BTC from the exchanges to your own wallet. 

The balance of the exchanges are melting. Feels bullish

https://www.coinglass.com/pro/i/Balance",negative
5,5,22-05-02,I often wonder if there will ever be a mass feeling of resentment toward pundits and financial advisors who warned people away from Bitcoin when they could have been getting multi-bag returns.,negative
6,6,22-05-02,"I'm pretty new, just started stacking last year. I initially got Coinbase and bought through there. Got a little into buying some altcoins, just small amounts of money to see what happens, gambling essentially. Learned more about Bitcoin, bought a hardware wallet, converted all those altcoins into Bitcoin. 

I know this is the Bitcoin sub so it's like ""yeah duh"", but seeing all this stuff going on with things like Solana, Crypto\_com, celebrities shilling rugpulls, it kind of furthers my belief in Bitcoin. You look up the uses of some of these coins or tokens or whatever and there's just absolutely no utility, really no apparent value. I mean it's gambling through and through.",negative
7,7,22-05-02,Time not timing. HODL,negative
8,8,22-05-02,Officially made it to 1.... Now for 2,positive
9,9,22-05-02,I just can’t understand how Munger can call Bitcoin evil while praising the fucking CCP in the same breath. It’s mind boggling,negative
10,10,22-05-02,"From Bitcoin Magazine

TESLA IN NEW SEC FILING: We believe in #Bitcoin's ""long-term potential"" and ""as a liquid alternative to cash""",positive
11,11,22-05-02,"Daily reminder:

Get your Bitcoin out of exchanges.

1> Helps you understand more about Bitcoin

2> Helps to stop exchanges suppressing Bitcoin price by lending out your Bitcoin to hedge funds

3> no one can freez your account",negative
12,12,22-05-02,Added 0.035,neutral
13,13,22-05-02,https://finbold.com/warren-buffett-misses-out-on-over-300-gain-in-bitcoin-since-he-first-called-it-rat-poison/,negative
14,14,22-05-02,"Binance sees again massive deposits, standing at 499,116.22290000 BTC   
as per [https://glasschain.org/](https://glasschain.org/)  


maybe one more round of discount coming? I have my FIAT ready",neutral
15,15,22-05-02,"If you want to stop me, you’re gonna have to kill meeeeeeeeee",negative
16,16,22-05-02,I love when bitcoin is down. Its like a five week long black friday,neutral
17,17,22-05-02,Just DCA'd some spare money. Wasn't much but the pennies will grow into beautiful dollars one day 🙆‍♀️,positive
18,18,22-05-02,How's everyone doing today?,neutral
19,19,22-05-02,How to reject BIP119?,negative
20,20,22-05-02,"I just want to hear more anecdotes from Warren Buffet about how he couldn’t have dessert before he said something mean about Roosevelt. 

“How can you have any pudding if you don’t eat yer meat?!”",positive
21,21,22-05-02,Bitcoin.,negative
22,22,22-05-02,"Don’t know why, but received 6 downvotes yesterday for simply saying: “been buying, will keep buying.” WTF?! Bought at 1100 and 3500, will buy at 38, 35, 29k…whatever. Keep stacking sats, my brethren (and sisters)!",negative
23,23,22-05-02,Pretty keen to hear n see a new version of the pump it up song soon.,positive
24,24,22-05-02,"If anyone used Taxbit via Gemini for their taxes. 

Not sure if Taxbit got hit but I've already received 3 emails today with something trying to phish me. 

It's an unblock email. It has a click button to enter credentials/unblock it. It's not blocked. 

Just putting that info out there in case others are receiving it.",negative
25,25,22-05-02,Only a matter of time before a big name announces purchases and we double overnight,positive
26,26,22-05-02,"Every single time I move bitcoin around on chain it is fast and cheap as hell. I haven’t had a LN payment through Muun fail ever. 

Bitcoin is a freakishly performant technology and network at this point. Working much more consistently and fluidly than when I was using the stack in 2019. 

I can’t fathom what’s going to be possible on bitcoin by 2030. Exponential tech is like that.",negative
27,27,22-05-02,Best app to set btc price alerts?,positive
28,28,22-05-02,People say that bitcoin cannot be controlled by the government but internet connections can. What's your response?,negative
29,29,22-05-02,"With all the talk of recession, food shortages, and nuclear war, is there any real possibility of hitting 50k anytime in the next few months?",neutral
30,30,22-05-02,"Conversation with my wife (who doesn't understand crypto):

Wife: ""why are people buying bitcoin? Isn't it just a currency? If i have dollars, i don't buy euros.""

Me: ""Well, a lot of people are going to get rich?""

Wife: ""Why would they get rich?""

Me: ""Well, the idea is that its the currency of the future, and everyone will use it.""

Wife: ""then wouldn't all your money just transfer to butcoin? Why would they be rich?""

Me: ""Because there is a finite supply of bitcoin. They only made so many.""

Wife: ""that sounds dumb. Why would they do that?""

Which.. I couldn't really answer. I understand that its to avoid inflation, but that necessarily means bitcoin is a deflationary asset (finite supply with a growing population). Deflation is bad for a currency. Good for an asset.

Which leads me to ask, how many here believe bitcoin will become an actual currency around the world? Or will it just remain an asset/store of value? 

If it's meant to become a currency, I see a somewhat moral problem with hoarding it now. Doesn't that reduce the amount available for others? Like those living in poverty or without internet (who would really need it the most)? And those not yet born don't even have a chance to get in early. Seems unfair, the opposite of the reason to switch to bitcoin as a currency.

EDIT: Why are there so many bot chats stemming from this sub?",neutral
31,31,22-05-02,"Man, I love Bitcoin.",positive
32,32,22-05-02,I was drinking coffee this afternoon and decided to do some TA and came to the conclusion that bitcoin will not go lower than 35k ever again.,positive
33,33,22-05-02,"I just sold a little Bitcoin.  Don't hate on me -- I only did it so that in case we drop, I can buy even more.  

But usually what happens when I sell is that we go on a big run.  

Either way, you're welcome.",negative
34,34,22-05-02,Are transactions going slow? I’m sending BTC from my hot wallet to coinbase and I’m going on 8 hours without confirmation. It’s shown up on coinbase as pending so I know the address is correct.,negative
35,35,22-05-02,Where do you think btc will go after fed meeting?,negative
36,36,22-05-02,Can anyone explain why Bitcoin is following the markets? I’ve been DCAing for a while but noticed Bitcoin is tied to the market. I thought it was suppose to be different from fiat in that regard?,negative
37,37,22-05-02,[removed],negative
38,38,22-05-02,Alts have just bottomed.,neutral
39,39,22-05-02,[removed],negative
40,40,22-05-02,"\*\*\*\*\*\*\*\*C/P\*\*\*\*\*\*\*\*\*\*

Came across this charts.

https://bmpro.substack.com/p/charts-update-042027?s=r",negative
41,41,22-05-02,12 word bip39 + passphrase = no haxxors?,neutral
42,42,22-05-02,"If you’re reading this and want to learn more about bitcoin, go to Twitter. The lack of Bitcoin education on Reddit is horrendous.",negative
43,43,22-05-02,"Dubious speculation:
2022 - BTC pushes ATH after spot ETF approval
2023 - $100k is broken 
2024 - BTC is a major election issue
2025 - IT GOES TO ZERO!!!",negative
44,44,22-05-02,They will just copy paste the daily,negative
45,45,22-05-02,They will sing glorious songs about us some day.,positive
46,46,22-05-02,"I'm just gonna paint here this graffiti for future troubadoures:

BORIS WAS HERE",negative
47,47,22-05-02,"I started buying in 2017 and have never sold a single sat.  I DCA weekly and if it goes back down into the 20s, I'm going to double that weekly DCA.",neutral
48,48,22-05-02,"Started buying little less than 2 years ago and waiting patiently to see what the purchasing power of Bitcoin is going to be in 10-20 years. My estimation is approx. 50x higher than what it is now.

Edit: I'm still buying more every week when I have extra cash after food and stuff.",positive
49,49,22-05-02,"Only 1 year for me, late to the party.  DCA weekly and don’t plan to sell a thing for a long long time.",neutral
50,50,22-05-02,June 2019 first purchase. Accumulating alot since late 2020.,positive
51,51,22-05-02,"In 3 days it will be 5 years since I first bought, still have every SAT",neutral
52,52,22-05-02,"It's never selling for me Unless it's do or die kinda situation. 

Until then I'm not fucking selling anything. No matter what happens in between no selling.",negative
53,53,22-05-02,"Twenty-Thirteen

Edit: I don't plan to ever sell. I'll be a millionaire or it'll go to 0. I've been holding for so long that it doesn't even matter. I periodically still buy too.",positive
54,54,22-05-02,"I'm a newbie, just had my 1st bitcoin anniversary in April.",positive
55,55,22-05-02,Dec 2020 right at the beginning of the pump from 19k.,positive
56,56,22-05-02,2011 -  Still holding a good chunk.,neutral
57,57,22-05-02,Summer of '73,neutral
58,58,22-05-02,Seems like I'm totally on the right track on just keeping a hold onto my Bitcoin though.,neutral
59,59,22-05-02,"Bitcoin will always be under attack. If it stays hard money, it will continue to win.",negative
60,60,22-05-02,"Yeah correlations in markets come and go. And sometimes they are persistent for a long time. But correlation does not mean always exactly mirroring the move but only the same direction. Today spy and broad markets are falling and btc surely is going down a bit too. But as of now it isn't as feaful as the classic markets. One can only hope that bitcoin can withstand the brutal beat down that will occur one day in the broader markets. But more importantly is, that bitcoin has risen always from downturns and bear markets.",neutral
61,61,22-05-02,"Well people do talk their narrative, there's nothing new about that.

They're only going to talk things which fits their narrative. And that's about it dude.",neutral
62,62,22-05-02,That's a misleading scale,neutral
63,63,22-05-02,"Yep, don't forget to do that. That can save you lot of shit.",neutral
64,64,22-05-02,"So far most of the resentment I've seen is directed toward the people who bought bitcoin in the past and still hold it, sadly. The pundits and FAs mostly all still have jobs.",neutral
65,65,22-05-02,Nope I feel people will always fall for them no matter what.,negative
66,66,22-05-02,"Same exact path as you.  Started out with 4-5 holdings, have consolidated all to BTC and cold storage.  The more you learn and the deeper into it you get you understand the beauty of Bitcoin.",positive
67,67,22-05-02,A lot of people have similar stories glad that you're here.,positive
68,68,22-05-02,"Timing isn't possible, so yeah time it is. That's most important.",neutral
69,69,22-05-02,Two whole sats?  That's a lofty goal.,neutral
70,70,22-05-02,Good to hear that though like keep doing that not always a bad day to do so.,neutral
71,71,22-05-02,"Buffet's main issue is that ""it doesn't produce anything."" That's the big disconnect.",negative
72,72,22-05-02,"He's old, he's grumpy he does't understand this new disruption.",neutral
73,73,22-05-02,yeh that was super disturbing to me. fuck the CCP.,negative
74,74,22-05-02,"I can’t believe they honestly think btc is inferior to fiat, haven’t they been crunching numbers for like six decades? Bitcoin is mathematics, mathematical purity - Steve Wozniak",negative
75,75,22-05-02,Can agree to you though like sometimes this kind of stuffs seems to be completely out of my head though!,neutral
76,76,22-05-02,No mention of dodgy shitcoins in their SEC filing? Weird.,negative
77,77,22-05-02,"That's bullish, atleast they're coming to their senses finally.",neutral
78,78,22-05-02,Would Bluewallet serve OK as a Hotwallet whilst I awaity cold storage delivery?,neutral
79,79,22-05-02,"Gotta love this daily reminder here, c'mon people follow suit.",positive
80,80,22-05-02,that's a nice DCA... oh fuck that's 1400$. I remember throwing away 0.1 BTC as a rounding error. :/,neutral
81,81,22-05-02,Sweet.,positive
82,82,22-05-02,Whale 🚨,negative
83,83,22-05-02,WALE ALERT,negative
84,84,22-05-02,Wew that is pretty indeed great I'm thus getting a positive vibe though.,neutral
85,85,22-05-02,"I like how he calls bitcoin poison, but owns 10% of Coca Cola.",positive
86,86,22-05-02,And my Mother literally can't turn on a computer and has never been on the internet.  This is what happens when you get old.  New technology tends to seem alien to you.,neutral
87,87,22-05-02,"Something turned from rat poison to $25, not bad.",positive
88,88,22-05-02,Good to see that though like by time we ought to see more incoming.,neutral
89,89,22-05-02,watching new season of ozark rn,neutral
90,90,22-05-02,None is indeed stopping you mate go whatever you feel do lmao!,neutral
91,91,22-05-02,The high time to just keep buying the sats and keep holding no matter what the circumstances arises!,positive
92,92,22-05-02,"I don't, TBH. In the long run what we want is stability (and moderate growth), not high volatility.",neutral
93,93,22-05-02,"> beautiful dollars 

🤮",positive
94,94,22-05-02,"Their purchasing power will grow as much as long you will hold it in Bitcoin. But as the ugly dollar keeps losing its purchasing power every day, I would not dream of trading scarce money back to that kind of money. Just hold the sats you buy for 10 years and then start to spend it directly as Bitcoin. Everyday more and more stores accept Bitcoin as a payment.",neutral
95,95,22-05-02,My sciatica is healing!,positive
96,96,22-05-02,"Not good I gotta say, the work has been hectic lately. Not enjoying.",neutral
97,97,22-05-02,"Miners vote on BIPs. It would need 90% approval so your best bet would be to convince miners that it is a bad proposal. Given the controversy around it including some big names being skeptical, I doubt you need to worry about it",negative
98,98,22-05-02,"Warren Buffet is older than prohibition. 

&#x200B;

EDIT\*\*  
Warren Buffett used to graph out his charts by hand. That's how old he is. LOL",neutral
99,99,22-05-02,Take my Floyd upvote!,positive
100,100,22-05-02,Bertcorn!,positive
101,101,22-05-02,Hehehe it's all what we want in the near future to turn out to be something fruitful enough!,positive
102,102,22-05-02,Some people press the downvote button even before they read it.,neutral
103,103,22-05-02,"I just checked your post history and I see [this comment](https://old.reddit.com/r/Bitcoin/comments/ufsm6b/daily_discussion_may_01_2022/i6z1442/):

> Still buying, will buy if it goes lower.

So you are saying that you try to time the market, which is ill advised, and that's probably why you got downvoted - as I type this, that comment of yours shows -4 karma.

Just buy as and when you have the funds available.",neutral
104,104,22-05-02,Don’t you know pump it up? You’ve got to dump it up!,negative
105,105,22-05-02,What's the song? Can someone tell me the song's link?,neutral
106,106,22-05-02,Does /u/txiao007 below count?,neutral
107,107,22-05-02,Just indeed waiting for that though like we are up to see some huge changes in the market.,neutral
108,108,22-05-02,Bitcoin ticker. iOS.,negative
109,109,22-05-02,Your exchange?,neutral
110,110,22-05-02,I think most major exchanges have that feature already.,negative
111,111,22-05-02,People say that when there's a new Daily some people keep posting on the old Daily.,negative
112,112,22-05-02,that a vpn solves all issues,positive
113,113,22-05-02,Magic 8 ball says Don't count on it.,negative
114,114,22-05-02,"Not likely.  And if that outcome is important to you, you maybe should not be in Bitcoin.  Bitcoin is highly volatile.  Having a short time horizon for trying to sell it is super risky.  This is the mother of all 'buy and hold' investments.  You really want to be in a position of selling on your terms and not because you have to - if you sell at all.  I've been buying since 2017 and never sold anything.  My time horizon is somewhere between five years and never selling - just depending on how comfortable I am with treating Bitcoin as my native currency vs converting some/all to fiat at some point. Consequently, I have only invested funds I wont need any time soon and that wouldn't destroy my financial stability if I lost every bit of it.",negative
115,115,22-05-02,Maybe because no one ever knows. But it could just be a good time to work as hard as possible in order to stack sats at a lower price…,neutral
116,116,22-05-02,"The idea that the money supply is supposed to go up and up forever is straight up propaganda. When they print more fiat money out of thin air, they are diluting the value of everyone else’s hard earned money. There are lots of people who believe that is somehow a good thing, because they have been sold lies.

There is nothing wrong with a currency that has a fixed supply, particularly if it can be infinitely divisible. There’s no way there wouldn’t be enough Bitcoin to go around, because it can always be divided into smaller and smaller amounts. If you can’t afford 1 BTC, then maybe you can afford 0.001 BTC. Or 0.00001 BTC.",negative
117,117,22-05-02,"""Getting rich by holding bitcoin is not an unfair reward for doing nothing. It's the market's just reward for divesting your wealth out of central banking & all the death, destruction & decivilization it brings the world."" - Saifedean Ammous",negative
118,118,22-05-02,"It doesn't reduce the amount available to others. Others will be able to convert as much fiat as they want when they're ready to do so. If they wait until it takes a week's worth of fiat salary to buy a soda, then they'll obviously only get a soda's worth of bitcoin for that week's worth of their fiat salary.

If there was no limit on the amount of bitcoin available, then bitcoin would have no value. Grains of sand aren't used as a currency because nobody would exchange goods or services for sand if they could simply walk down to the beach and grab a handful of sand to exchange for lunch instead.",negative
119,119,22-05-02,"i mean, what's the alternative, holding a fiat currency in which you are literally losing purchasing power of on a weekly basis? I am still shocked that people actually want to ""save"" and hold on to any more than a few thousand dollars. The central banks are literally crushing your currency right before your eyes. Home prices up, car prices up, grocery bills up. How many more red flags do people honestly need? This is what happens when your gov't prints 40% of all fiat currency in circulation in less than 2 years. 

You should do an experiment with her, buy $500 of bitcoin and in 5 years lets see what you can purchase with that bitcoin vs what she can purchase with $500. this will be fun....",negative
120,120,22-05-02,"It's the only thing that I love and it doesn't love me back.

Sometimes I just feel like that it even hates me lol. That's just how I feel dude.",negative
121,121,22-05-02,"Maybe a quick wick to 30-31k….be pretty quick though, just IMO. Bitcoin has endured a global pandemic, war, and economic calamities all throughout the world at this point. This asset is going substantially higher and that is all there is to it. It has the best, strongest and most decentralized monetary network ever created. Those other countries and funds are correct to be scared of this beast…………",positive
122,122,22-05-02,"Now that's some quality TA right there, i agree with it.",positive
123,123,22-05-02,Risky trying to trade this market most people lose money better off just hodling and buying dips/dca,negative
124,124,22-05-02,"Many thanks! I was thinking of taking one for the team, but now I don't have to.",positive
125,125,22-05-02,That's a big assumption to make I hope it plays out for you.,neutral
126,126,22-05-02,[deleted],negative
127,127,22-05-02,I just tranfered from exhance to wallet and it takes 4 minutes.,negative
128,128,22-05-02,"I sent some to cold storage this morning and it was strangely fast, couple minutes maybe.",negative
129,129,22-05-02,"It can take time I know but 8 hours? That's too much tho.

This shouldn't take that long, it's just taking too long. Maybe you should wait some more time.",neutral
130,130,22-05-02,"Is it me, or does it seem there’s a fed meeting every week?",neutral
131,131,22-05-02,Man I'm trying to figure that out! I looked back to the March charts which was the first rate hike. It was a sell the rumor/buy the news apparently.,negative
132,132,22-05-02,When is it?,neutral
133,133,22-05-02,"If the rate hike is more than what everyone is expecting, it will go down. If the rate hike is less, or the same thing everyone was expecting, it might rally a bit.",neutral
134,134,22-05-02,I haven’t been here for 6 years for “coolness” 😂,positive
135,135,22-05-02,The kids don't have any money.,negative
136,136,22-05-02,"Nft’s will be hyped out soon.
Bitcoin is forever.

And than there is you with zero cash left on your jpeg investment.",negative
137,137,22-05-02,Have fun staying cool,neutral
138,138,22-05-02,I dont care about cool.  Kids will learn some day to,neutral
139,139,22-05-02,I upvoted you (from -3 to -2 lol) on the assumption that your comment is pure sarcasm.  I sincerely hope that my faith in you is not misplaced.,negative
140,140,22-05-02,Apples to oranges,negative
141,141,22-05-02,I'm down 500+ in APE 😁,negative
142,142,22-05-02,"I haven’t seen or heard someone mention NFT’s in 3+ weeks, when I used to hear about them daily earlier this year it seems.",neutral
143,143,22-05-02,Most alts' bottom is zero.,neutral
144,144,22-05-02,"Lol, they haven't. If btc goes down they'll bleed even more.

And besides this is a btc sub and not your alts sub so please don't talk about them here.",neutral
145,145,22-05-02,He's not. He's a pathetic scammer that is irrelevant to Bitcoin. Shitcoins and other such scams are also off topic. Keep this BS off here.,negative
146,146,22-05-02,As long as it never touches your computer.,neutral
147,147,22-05-02,Twitter? A trashy  troll and meme site with a 140 character limit? How on earth could an intelligent detailed discussion on bitcoin technology occur there?  I would have recommended BitcoinTalk,negative
148,148,22-05-02,Well that escalated quickly,negative
149,149,22-05-02,100k is a given and name checks out.,neutral
150,150,22-05-02,Keep your day job,positive
151,151,22-05-02,Can't imagine going to literal zero. If it gets close I promise to buy all the BTC for at least a penny.,negative
152,152,22-05-02,"For sure dude, this is a really important part in human history.

And future is going to embrace the chaos that has been going on now, btc will save us.",neutral
153,153,22-05-02,"Lol, now you've got your name in the history. Now it's done.",positive
154,154,22-05-02,Everytime I come across people who tend to hold for longer and longer just makes me so happy.,positive
155,155,22-05-02,Hell with food. Food don’t grow in value. I put everything in btc lol jk,negative
156,156,22-05-02,Never too late just keep going keep buying and jeep holding the future is indeed shinier!,negative
157,157,22-05-02,"This will be a funny post in 5 years - ""late to the party"" when it was under $250k.",neutral
158,158,22-05-02,"I was sure to be late to the party 5 years ago, so did everyone before me.

the party hasn't even started fam.",negative
159,159,22-05-02,Never too late just keep going hold for more and more and the best will be infront of you in the upcoming years.,positive
160,160,22-05-02,Good for you though just keep holding at the worst scenarios too.,positive
161,161,22-05-02,Same!,positive
162,162,22-05-02,Good to hear that though like most of them are keeping a good holdings onto their coins.,neutral
163,163,22-05-02,Good though and somewhat that encourages me to keep holding more and more!,positive
164,164,22-05-02,You have been holding since a long time great one keep going long way to  go!,positive
165,165,22-05-02,"Well they can attack it, but they can't change it so there's that.",positive
166,166,22-05-02,"Scale does not matter. The direction is the most important thing. Fast or slow, direction is clearly that people sends their newly acquired hard money to cold wallets for long time storage.",negative
167,167,22-05-02,"That's my first thought as well.  You can't change the date, the scale is misleading, garbage site.",positive
168,168,22-05-02,I agree with you guys but this is the actual website where you can see up to date data for free. On glasscoin you have to pay for this,negative
169,169,22-05-02,"The thing about scales is that I don't believe in any.

And you shouldn't too, especially the ones that you see online. Don't believe them at all.",negative
170,170,22-05-02,"Yep, the people who believe in them are the real problem.",negative
171,171,22-05-02,Much like his bank shares and credit default swaps?,positive
172,172,22-05-02,True though but the fact that we tend to see Bitcoin on all high heights someday!,neutral
173,173,22-05-02,True though but we should look forward and just be adaptive this growing digital world.,neutral
