,Unnamed: 0,date,comments,sentiment
174,174,22-05-02,Absolutely true though sometimes it's good to ignore certain serious stuffs!,positive
175,175,22-05-02,They don't know what the future is all up for they be sticking onto fiat and think they don't have other world beside this,negative
176,176,22-05-02,Some people still needs to know what Bitcoin is and how it actually looks like.,neutral
177,177,22-05-02,"Don't remind elon that he may actually do it lmao, he's gonna do it.

Elon has got so much money I don't understand why he embraces the shit coin that he shouldn't.",negative
178,178,22-05-02,"Their SEC filing calls out Crypto, not Bitcoin. Bitcoin Mag changes any reference to crypto to bitcoin as a default.",negative
179,179,22-05-02,Yup,positive
180,180,22-05-02,just wait until your hardware wallet shows up,neutral
181,181,22-05-02,"I'd say just wait for the hw wallet, then only proceed further.",neutral
182,182,22-05-02,Something is indeed growing so fast that seems though like let that come.,neutral
183,183,22-05-02,More to go though like the market is what is giving me a positive vibe though.,neutral
184,184,22-05-02,Alert incoming the red light is pretty well glowing fast and instant enough.,positive
185,185,22-05-02,Someone gotta let him know what Bitcoin is all about and he would start praising Bitcoin.,negative
186,186,22-05-02,This is what happens when you get old. New technology tends to alienate you.,negative
187,187,22-05-02,"I’m 57 and feel old as hell when it comes to technology. With bitcoin it made too much sense to me to pass up. I sucked it up and learned. 

I think anyone who grew up in the era of Pong being the pinnacle of technology can learn. You have to sell them on the very non-technical concept of scarcity vs. nonstop printing of fiat. Every generation has had their version of Venezuela. Gold is usually the response. Then you read about some poor sap from India getting caught trying to smuggle his own gold out of the country melted into a dildo and crammed up his ass. Only to lose his gold nevermind the prison sentence. 

Makes 24 words look damn attractive even for an old bastard like me",negative
188,188,22-05-02,"It's hard to hold that against anyone.  My grandparents grew up in a time when electricity was a novelty, and lived long enough to play with pocket computers with augmented reality that connect to a real-time global information network, that people today consider ubiquitous and mundane.  
  
I mean think about that for a minute.  Right now AR, VR, IoT, autonomous devices... all of that is ""no big deal"".  Can you imagine how wild cutting-edge tech will be in 30 years from now?  How about in 60 years?  Now imagine being in your 90s and trying to make sense of whatever is considered ""fringe"" tech at that time.",neutral
189,189,22-05-02,Make her understand and help her learn about it. Age doesn't matter if you make them learn how tech works!,positive
190,190,22-05-02,Can be seen that though better to just let stop poisoning around though!,neutral
191,191,22-05-02,No doubt about that patience has always turned to be benificiary though.,neutral
192,192,22-05-02,"I need to start it, want to watch final episodes but also bummed that the series is done now.",positive
193,193,22-05-02,Same. Finished the new episodes last night it was okay.,neutral
194,194,22-05-02,I was indeed too planning to watch it but my busy schedule doesn't let me do that.,neutral
195,195,22-05-02,"That's my thought, too. With time BTC will also be useful as spending money, no reason to revert back to fiat.

Question: which fiat currency will still be alive in ten years and what will its value be compared to its value today??",neutral
196,196,22-05-02,That's brilliant!,positive
197,197,22-05-02,Same bro same,positive
198,198,22-05-02,How just rest?,neutral
199,199,22-05-02,What's sciatica is anyway? I don't even know about it.,negative
200,200,22-05-02,Miners don't vote. They signal readiness. Or not.,negative
201,201,22-05-02,Some people are mentioning refusing accepting these miners blocks with their nodes. How?,neutral
202,202,22-05-02,"Yeah this isn't going to happen, I don't see this happening.",negative
203,203,22-05-02,"I bet he used an abacus early in his career as well. It's like expecting cavemen to understand the internet, it'll never happen.",neutral
204,204,22-05-02,"I mean he deserves it, he's absolutely got the sense of humour.",positive
205,205,22-05-02,Bitcoin being the love and I feel that you are indeed too a lover of it <3.,neutral
206,206,22-05-02,Is it my imagination or is there a spate of posters lately churning out banal one line word salads?  Is this autogenerated text or something?,neutral
207,207,22-05-02,"Do whatever you want, the point is you just keep on buying.",positive
208,208,22-05-02,Yes,neutral
209,209,22-05-02,Why not man that indeed actually counts though! But all of a sudden you asked this?,neutral
210,210,22-05-02,"That's a good name for an app I gotta say, it's a good name.",neutral
211,211,22-05-02,what?,negative
212,212,22-05-02,None can actually give a clear vision of what the price would look like in the near future!,neutral
213,213,22-05-02,">The idea that the money supply is supposed to go up and up forever is straight up propaganda

Woah. Thats quite a conspiracy. 

Deflation is not good for currency. It incentivizes hoarding, not spending nor investing. What generally happens here is people start to trade alternative stand-ins for bitcoins. Especially ones that won't be worth as much later. Buyers like to buy with things/tokens/currencies that will be less valuable later, not the other way around. 

Moreover, this infinite division of bitcoin isn't a good thing. You'll see an evershrinking supply of bitcoin being shared amongst each new generation, as bitcoin is accumulated pining the earlier adopters. You're going to end up with a mega wealthy class of earlier adopters. This type of division is really great for people that already own a lot of bitcoin, but not so much for others. Knowing that there will be less bitcoin for others the share and use, **how can you morally justify buying and hoarding it now.**",negative
214,214,22-05-02,"There's a finite supply of bitcoin. However much bitcoin you have, necessitates that the rest of the world has less. The more you have, the less others will have to share amongst themselves. 

At the moment, over 500 million people around the world live below the international poverty line. This group has no means to accumulate bitcoin at all at the moment. If affluent citizens in first world countries mine and accumulate ask the bitcoin, what happens to this group?",negative
215,215,22-05-02,"Our debate seemed to sideline and hit a stall. My point is that buying bitcoin *necessarily* reduces the supply left for others. 

Your comment has:

>It doesn't reduce the amount available to others

>If there was no limit on the amount of bitcoin available, then bitcoin would have no value

These seem like contradictory statements to me. My point was: there is a finite supply of bitcoin. When someone buys bitcoin, it *reduces the supply* for others. Taken to a logical extreme: if 21 million people each bought 1 bitcoin, how much would be left for everyone else?",negative
216,216,22-05-02,">It doesn't reduce the amount available to others

Yes it does. If you have 1 bitcoin, then the rest of the world permanent has one less bitcoin to share amongst themselves. This makes the bitcoin more valuable, the entire reason for buying in early.

>If they wait until it takes a week's worth of fiat salary to buy a soda, then they'll obviously only get a soda's worth of bitcoin for that week's worth of their fiat salary.

Are you saying that the non bitcoin holders are going to be living in poverty?",negative
217,217,22-05-02,"I don't know anyone who saves all their money as cash. You're supposed to invest it.

Maybe a good comparison would be $500 bitcoin and $500 in SPY.",negative
218,218,22-05-02,Btc is looking strong and that's why it won't go below 35.,neutral
219,219,22-05-02,"Yep, only if you wanna get rekt then do this. Otherwise Avoid.

The best thing that you can do is to hold and that's it. There's no other Better way in this market.",positive
220,220,22-05-02,There it is! Thank you,positive
221,221,22-05-02,Somehow the minute I post on Reddit the transaction confirms. Still waiting to show on cb though,neutral
222,222,22-05-02,That’s usually how it works for me but today for whatever reason I’m sitting out there unconfirmed,negative
223,223,22-05-02,"Well that's fair, can wait for that long I guess. Shouldn't be a problem.

I mean block time is 10 mins, so that should be the minimum you're looking for on btc.",neutral
224,224,22-05-02,Couple minutes? Damn. Your transaction got included right away.,negative
225,225,22-05-02,It went through right as I posted in this sub lol,negative
226,226,22-05-02,Lol! For sure,positive
227,227,22-05-02,"And these ape jpegs are going to make them even more poor.

They're going to go broke, I don't see any others way here, it's just go broke mode for them.",negative
228,228,22-05-02,"Kids can be cool all they want, I don't wanna be cool.",negative
229,229,22-05-02,"Lol, people here don't get sarcasm so no point in trying that in here.",neutral
230,230,22-05-02,Well why the fuck did you even buy into that scam? Don't do that.,negative
231,231,22-05-02,Yep and eventually they'll go there too. Trust me on that.,positive
232,232,22-05-02,"""Most"".... Yes

But the ones I just sold into BTC have now bottomed. They'll be up 10% tomorrow I'm sure. I love finding and selling bottoms.",neutral
233,233,22-05-02,Isn't it as long it never touches internet? I don't speak computish to know how addresses are made 🤭,neutral
234,234,22-05-02,140 Character limit isn't that enough to describe Bitcoin if you know you know!,neutral
235,235,22-05-02,Is bitcointalk the best? It look outdated lol,neutral
236,236,22-05-02,"Well that's the case with everything here, it escates quik.",neutral
237,237,22-05-02,"Your name doesn't checkout tho, what's up with that?

This is the last thing that I imagine peter schiff would say, I don't expect him to say that.",negative
238,238,22-05-02,"Keep that job and keep on hustling boys, thags the way.",positive
239,239,22-05-02,Nah mate I'm planning on buying a few when they hit 2 pence,negative
240,240,22-05-02,As long as there are holders people can dream about cheap sats.,neutral
241,241,22-05-02,If I can look back and say that in 5 years I’ll gladly call myself an idiot for saying this haha.,negative
242,242,22-05-02,And then someone would just comment out there damn dude I missed the party.,negative
243,243,22-05-02,It will start and will indeed last long enough so everyone are indeed welcome.,positive
244,244,22-05-02,Im more than happy with my stack.,positive
245,245,22-05-02,"And they want us to pay for that lmao, that's never gonna happen.",negative
246,246,22-05-02,You have to pay for these charts? Well that doesn't seem fair.,negative
247,247,22-05-02,"I'm sure he would argue banks produce services and he does love insurance, which is basically what CDS's are.",positive
248,248,22-05-02,The interest and other stuffs is what make people take a back from Bitcoin though!,neutral
249,249,22-05-02,"That's quite a shady editorial position, but not surprising",neutral
250,250,22-05-02,That's why I don't really believe in the bitcoin magazine anymore now.,positive
251,251,22-05-02,"Cheers! 

Would you recommend any exchanges?

I have left Coinbase after a horrible experience where they made authenticating my 2FA extremely longwinded, it made me feel as if they wanted me to give up so they could keep the coins lol",positive
252,252,22-05-02,"Yep, that would be the smart thing to do here, wait for it.",positive
253,253,22-05-02,True though I too help my mom whenever she finds any difficulty with technology.,positive
254,254,22-05-02,"I let her on my laptop once because we were going to watch a movie and she wanted to read reviews.  Did not go well.

She just bought a new flip phone a month ago.  Intentionally without internet access.  I tried to convince her otherwise, but no go.

I'm afraid her days of learning and understanding new tech are long past.",negative
255,255,22-05-02,"It was a pretty good final run, but they ran out of ideas at the end.  Better to end it where they did than to make a bad season, a lot of shows make that mistake.",neutral
256,256,22-05-02,Looks like this is thus getting intense enough though need to have a look at it.,neutral
257,257,22-05-02,And the people who are selling it for the fiat are going to regret.,negative
258,258,22-05-02,Thanks for the clarification,positive
259,259,22-05-02,Nodes choose which version of the Bitcoin program they want to run. They can opt to run a version that rejects blocks from miners who are using a version of the software with CTV enabled. The nodes would essentially recognize the blocks as coming from an invalid source. It's unlikely that BIP119 will attain sufficient support from miners so it is unlikely that nodes will need to resort to this type of rejection.,negative
260,260,22-05-02,"They don't accept the change in code and they keep on mining.

They keep on working on the old chain, that's how it usually works so there's that.",negative
261,261,22-05-02,Well some caveman have rather rich expectations and they get disappointed.,neutral
262,262,22-05-02,Indeed matters though like we needed that count for something to make good.,neutral
263,263,22-05-02,"Shut your hole, Bot. You’re fooling no one",negative
264,264,22-05-02,They're saying you're posting on yesterday's daily discussion,negative
265,265,22-05-02,PEOPLE SAY THAT WHEN THERE'S A NEW DAILY SOME PEOPLE KEEP POSTING ON THE OLD DAILY,negative
266,266,22-05-02,"Deflation is good, you should check out the book “The Price of Tomorrow: Why deflation is key to an abundant future” by Jeff Booth. Technology is deflationary, would you argue you that’s bad? No because you’re getting more for less. That’s what Bitcoin will continue to do, things will simply cost less. A house 5 years ago would’ve cost hundreds of bitcoin, in 5 years from now it’ll cost less than 10 bitcoin.",negative
267,267,22-05-02,"> buying and hoarding it now.

"" It incentivizes hoarding, not spending nor investing."" 

I think good innovation, products and ideas should incentivise spending e.g. if i see a good laptop that i like I buy it regardless of the fact that it will depreciate & if i am hungry i will still buy food. I shouldnt have to invest so before my money looses   value. 

Money value should reflect the hours of work you do in your job and this value should be stored because you put in the hours. 

The current system leads to overinflatted assets e.g. look at housing. People buy houses to store their value and this leads to people that cant afford houses.

btc = the ideal asset and store of value. it is a better form of what gold should have been currently.

if people bought btc to store their value, then other assets would not be overvalued e.g. people would afford their own home to live in and investing in property for the sake of storing value is pointless

morally we are not hoarding it. because btc is divisible future generations will still benefit from it and their value will be stored. 

 If I hoard it, use it as collateral, never spend it, then die and pass it onto my kids - who then aim to accumulate more of it and never sell it and use it as collateral... then my lineage will benefit. My kids wont need to worry about money and can instead focus on creative outputs e.g. art, music, creativity, innovation.....which they can store the value of by accumulating more btc..... if they choose to get hooked on drugs  and spend all the btc away then they will destroy the value they had stored and this is essentially reflecting that their output has gone down ....  thats not my problem cause im dead lol 

too many people work for money and this stiffles their creativity and limits innovation of humans... 

youtube: aantonop he will likely answer your questions",negative
268,268,22-05-02,The fact that everything has an inflation or deflation so it is always better to check and make your future moves.,neutral
269,269,22-05-02,Good enough always just to buy the sats and keep them holding for future!,positive
270,270,22-05-02,">asset/store of value?

when the poor buy it and the rich buy it, the poor get richer too... distribution of wealth... it will give the poor the same instruments the rich have been using to maintain their wealth e.g. use as collateral and preserve value to pass onto their future generations - this isn't about lambo, it's to preserve what your value i.e. proof of your work...",neutral
271,271,22-05-02,"I believe you've mistaken me for 'your wife'...

...if some entity in the future is 'buying' it, then there is necessarily some counterparty 'selling' it. You obviously know that a finite supply does not equal an illiquid market.

Unfortunately you've been disingenuous at best with your bait and debate tactics, good day and good luck with your agenda.",neutral
272,272,22-05-02,I get your point the demand seems to be increasing in a larger amount and I feel that it makes a difference in the price.,neutral
273,273,22-05-02,"No it doesn't. Many (most?) people have exchanged fiat for existing bitcoin, versus mining their own. How will that change?

I said nothing of the sort. I've no idea how each individual's current medium of exchange will or won't inflate. I gave you an example along the spectrum of possibilities. Switch soda for Ferrari and week for day if it helps compare and contrast.",negative
274,274,22-05-02,"btc is divisible e.g. 0.00000000001 btc can be bought. 

and every single sat, will maintain it's purchasing power

it's a store of value 1st

countries still need their own currencies so citizens can pay tax to fund their countries infrastructures

eventually after all btc is mined and price stabilises, the price of btc will go up 3-4% per year in line with productivity curves 

youtube aantonop, has answers to a lot of these questions",neutral
275,275,22-05-02,It ain't like that mate why would they live in poverty it's still the time to just buy and hold.,neutral
276,276,22-05-02,"Yep, it's the reason for delay, nothing other than this.",negative
277,277,22-05-02,"It can't get confirmed right away, it takes time man.",neutral
278,278,22-05-02,You should check it on the blockchain explorer I guess.,neutral
279,279,22-05-02,"Average is 10 min. You need to learn more, young hodler.",neutral
280,280,22-05-02,Let's see what indeed happens though like we ought to see something great!,neutral
281,281,22-05-02,This would be very valuable information over on r/cryptocurrency. Would get lots of upvotes.,negative
282,282,22-05-02,No trader ever made money,negative
283,283,22-05-02,"You sound so retarted right now lmao, this is just dumb.",negative
284,284,22-05-02,"No part of your private key should ever touch a device that is, was, or ever will be connected to a network.

If you want to set up a device with no network connection to manage your private keys, that's OK.  A hardware wallet serves this purpose.",neutral
285,285,22-05-02,"Well well, sounds like you're going to be waiting for a long time now.",positive
286,286,22-05-02,"Okay, but if banks produce services, doesn't Bitcoin as well? It provides a global settlement system (among other things).

Not arguing with you. Arguing with Buffet lol",neutral
287,287,22-05-02,Damn I have heard about love insurance for the first time though.,neutral
288,288,22-05-02,Yah it kinda sucks. They’re not lying exactly since crypto does actually include Bitcoin in all cases that they’d use it but it’s a little dishonest. They’ll even change quotes.,neutral
289,289,22-05-02,"KYC is a nuisance.  A lot of it is outside the control of the exchange, though I'm sure some handle it more smoothly than others.

If you live in a jurisdiction supported by Strike (U.S.A., El Salvador), they would be my first recommendation.  Otherwise Kraken.

I have never used either service but I hear consistently good things about both of them.  I'm sure other folks here will chime in with other recommendations.",neutral
290,290,22-05-02,I mean if you're in the US then use Strike. That's the best.,neutral
291,291,22-05-02,"Yep, and that's how the new rules get implemented on btc.",negative
292,292,22-05-02,Haven't read that yet but someone recommend that too I would read that soon. Anyways thanks!,neutral
293,293,22-05-02,"That makes it a great asset, but not a great currency.",neutral
294,294,22-05-02,Make something investable enough that brings you some good gains and profits in the coming time period.,positive
295,295,22-05-02,"To illustrate my point, I will ask:

>How will that change?

Why buy bitcoin now? Why not just wait until later when it's adopted?",negative
296,296,22-05-02,The fact that future is more worthy of Bitcoin to that of fiat we look forward for future!,positive
297,297,22-05-02,"Yeah lol, but not going to get any here. That's just not gonna happen.",neutral
298,298,22-05-02,"Well maybe they're here to lose money, that's what they'll do.",negative
299,299,22-05-02,"Yes, and that's my original point. There's a disconnect in his understanding, but that goes without saying I suppose.",neutral
300,300,22-05-02,That would be indeed a waste to just argue on this topic though like calling Bitcoin an evil and what to argue.,neutral
301,301,22-05-02,"Appreciate it, kraken seem like a good choice",positive
302,302,22-05-02,"Kraken has been one of my exchanges for 2 years, the other Is Kucoin. Both are good, Kraken has been a better choice for me to receive $USD. Kucoin has more selection and better fees but I haven't set it up to receive fiat.

Coinbase easily works with ACH transfers but its fees are ridiculous.",neutral
303,303,22-05-02,True though sometimes time and patience is what make great things happen and it takes ages.,positive
304,304,22-05-02,I didn't realize you were attempting to make a point. Exchange for bitcoin now if you would like to support the growth of the network by signalling demand and/or transacting with it. Also exchange for it now versus later if you believe the exchange rate will be more favourable now versus later.,negative
305,305,22-05-02,"Yeah kraken is good, I think you'll be happy with that.",positive
306,306,22-05-02,Kucoin is good only if you're looking to buy shit coins.,neutral
307,307,22-05-02,But that indeed would take a bit time as because this is what I feel towards the market.,neutral
